{
  "schema_version": "0.1",
  "id": "8c2f1d44-0a7e-4b19-9b3a-7e6d5c4b3a21",
  "created_at": "2026-06-09T11:40:00Z",
  "tool": "anchor",
  "surface": "anchor check --probe",
  "kind": "friction",
  "heuristic": "honest_verdicts",
  "severity": "high",
  "task": "verify the setup before ingesting a sensitive document",
  "expected": "the probe passes if and only if a real ingest would work",
  "actual": "the probe reported 'not ready - vision deployment did not respond', but a real ingest succeeded with 38 regions across all pages. the probe sent a deprecated max_tokens parameter the model rejected; the ingestion path sends neither token param.",
  "workaround": "ignored the probe verdict and ran the ingest, which worked",
  "agent": "claude-opus-4-8",
  "session_hint": "AX test session, fresh agent driving anchor via CLI"
}
